{
  "$schema": "https://json-schema.org/draft/2020-12/schema",
  "$id": "os-skill-test-case",
  "title": "Claude OS lightweight skill regression test case",
  "description": "Declares a scenario and expected contracts checked against skills-manifest.json and capability-manifest.json (no LLM).",
  "type": "object",
  "additionalProperties": false,
  "required": [
    "schemaVersion",
    "id",
    "skillId",
    "routeId",
    "scenario",
    "inputSummary",
    "expectedOperatingMode",
    "expectedRequiredApprovals",
    "expectedValidators",
    "forbiddenActions",
    "expectedRefusalOrAbortConditions"
  ],
  "properties": {
    "schemaVersion": {
      "type": "integer",
      "const": 1
    },
    "id": {
      "type": "string",
      "pattern": "^[a-z0-9]+(-[a-z0-9]+)*$",
      "description": "Unique test case id (kebab-case)"
    },
    "skillId": {
      "type": "string",
      "description": "Must match a skills-manifest.json skills[].id"
    },
    "routeId": {
      "type": "string",
      "pattern": "^route\\.[a-z0-9]+(-[a-z0-9]+)*$",
      "description": "Must match a capability-manifest.json routes[].id; route must list skillId in relevantSkills"
    },
    "scenario": {
      "type": "string",
      "minLength": 8
    },
    "inputSummary": {
      "type": "string",
      "minLength": 8,
      "description": "Human-readable intent of the simulated task (not executed)"
    },
    "expectedOperatingMode": {
      "type": "string",
      "enum": [
        "read-only",
        "standard",
        "strict",
        "controlled-change",
        "break-glass",
        "release-gate"
      ],
      "description": "Must equal capability route operatingMode"
    },
    "expectedRequiredApprovals": {
      "type": "array",
      "description": "Each entry must match route.requiredApproval (case-insensitive) or appear in the skill's requiresApprovalFor (case-insensitive)",
      "items": {
        "type": "string",
        "minLength": 1
      }
    },
    "expectedValidators": {
      "type": "array",
      "minItems": 1,
      "description": "Each substring must appear in at least one route.validators line (case-insensitive)",
      "items": {
        "type": "string",
        "minLength": 2
      }
    },
    "forbiddenActions": {
      "type": "array",
      "minItems": 1,
      "description": "Each substring must appear in at least one route.forbiddenShortcuts line (case-insensitive)",
      "items": {
        "type": "string",
        "minLength": 4
      }
    },
    "expectedRefusalOrAbortConditions": {
      "type": "array",
      "minItems": 1,
      "description": "Each substring must appear in route.forbiddenShortcuts or route.expectedEvidence (case-insensitive)",
      "items": {
        "type": "string",
        "minLength": 4
      }
    },
    "expectedSkillRiskLevel": {
      "type": "string",
      "enum": ["low", "medium", "high", "critical"],
      "description": "When set, must equal skills-manifest entry riskLevel"
    },
    "expectedRouteRiskLevel": {
      "type": "string",
      "enum": ["low", "medium", "high", "critical"],
      "description": "When set, must equal route riskLevel"
    }
  }
}
