{
  "schemaVersion": 1,
  "id": "incident-production-safety",
  "skillId": "production-safety",
  "routeId": "route.incident",
  "scenario": "Active incident response; production-safety remains on the break-glass incident route with incident-command approval.",
  "inputSummary": "Incident / outage / rollback task; route.incident; production-safety among relevantSkills.",
  "expectedOperatingMode": "break-glass",
  "expectedRequiredApprovals": ["incident-command", "Incident", "Production"],
  "expectedValidators": [
    "verify-os-health.ps1",
    "verify-security-policy.ps1"
  ],
  "forbiddenActions": [
    "Undocumented production config",
    "Broad refactors",
    "rollback criteria"
  ],
  "expectedRefusalOrAbortConditions": [
    "Incident playbook",
    "Decision log",
    "rollback"
  ],
  "expectedSkillRiskLevel": "critical",
  "expectedRouteRiskLevel": "critical"
}
